{
  "pass": 1,
  "status": "rolled_back",
  "targets": [
    {
      "issueId": "fidelity-typography",
      "category": "fidelity",
      "dimension": "typography",
      "objectNames": [
        "cover-title",
        "slide-title",
        "*-title",
        "*-value*",
        "*-label",
        "*-claim",
        "*-answer",
        "*-lead",
        "*-callout",
        "timeline-decision",
        "gate-copy"
      ],
      "adjustments": {
        "fontScale": 0.93
      },
      "action": "Adjust only the failing reference-fidelity dimension; preserve all locked style dimensions."
    }
  ],
  "createdAt": "2026-08-22T12:33:14.038Z"
}